{
  "schema_version": 1,
  "updated_on": "2026-10-30",
  "scope": "Research candidates only. No entry is admitted or release-qualified.",
  "methods": [
    {
      "id": "M-000001",
      "name": "BM25",
      "aliases": [],
      "family": "text_retrieval",
      "kind": "algorithm",
      "stage": "candidate",
      "counts_toward_release": false,
      "source_ids": [
        "SRC-0001"
      ],
      "summary": "Score word matches with diminishing returns for repeated terms and an adjustment for document length.",
      "proposed_use": "Find lexical destination candidates.",
      "applicability": "Research only until admitted. The approved specification must define available evidence, public-content permissions and missing-data behaviour.",
      "input_contract_draft": "Term frequencies, document frequencies and document lengths.",
      "output_contract_draft": "A score per query-document pair.",
      "distinctness": {
        "review_status": "pending",
        "hypothesis": "Compare equal term counts in different-length documents; verify repetition saturates rather than growing without bound.",
        "not_separate_methods": "Tokenisation changes, weight choices and alternate k1 or b values.",
        "duplicate_of": null
      },
      "test_ideas": {
        "distinguishing_example": "Compare equal term counts in different-length documents; verify repetition saturates rather than growing without bound.",
        "edge_cases": "An empty query; no matching terms; invalid lengths; a term found in every document.",
        "missing_evidence": "Return a visible pending state when required inputs are absent; do not fabricate data.",
        "usefulness": "Predeclare a task-specific comparator and acceptance threshold, then evaluate on held-out data with relevant subgroups.",
        "recovery": "Interrupt at each committed work boundary and confirm deterministic replay or declared stochastic equivalence without losing completed work."
      },
      "resource_plan": {
        "work_unit": "One bounded postings chunk.",
        "checkpoint_contents": "Posting cursor, query identity, statistics version and partial accumulators.",
        "peak_memory_bytes": null,
        "qualified_workload": null,
        "measurement_status": "unrun",
        "constraint": "Production analysis shares the combined Python-worker limit; lab research uses its separate approved profile. A resource plan is not proof that this method fits."
      },
      "rights": {
        "status": "not_reviewed",
        "jurisdictions": [
          "UK",
          "EU",
          "US"
        ],
        "copied_implementation": false,
        "dependency_admission": "none",
        "model_and_dataset_admission": "none",
        "patent_evidence": [],
        "decision_receipt": null
      },
      "approval": {
        "specification_path": null,
        "owner_approval_receipt": null
      },
      "evidence": {
        "implementation_paths": [],
        "test_receipts": [],
        "usefulness_receipts": [],
        "resource_receipts": [],
        "review_receipts": [],
        "release_receipt": null
      },
      "exclusion": null
    },
    {
      "id": "M-000002",
      "name": "TF-IDF cosine retrieval",
      "aliases": [],
      "family": "text_retrieval",
      "kind": "algorithm",
      "stage": "candidate",
      "counts_toward_release": false,
      "source_ids": [
        "SRC-0002"
      ],
      "summary": "Compare normalised sparse word vectors after reducing the influence of common terms.",
      "proposed_use": "Provide an interpretable lexical comparator.",
      "applicability": "Research only until admitted. The approved specification must define available evidence, public-content permissions and missing-data behaviour.",
      "input_contract_draft": "Versioned vocabulary, corpus frequencies and sparse document vectors.",
      "output_contract_draft": "Similarity per source-destination pair.",
      "distinctness": {
        "review_status": "pending",
        "hypothesis": "Construct two candidates with the same overlap count but different term rarity; check a repeated proportional vector keeps the expected cosine relationship.",
        "not_separate_methods": "Different normalisation settings, token vocabularies or term-weight constants.",
        "duplicate_of": null
      },
      "test_ideas": {
        "distinguishing_example": "Construct two candidates with the same overlap count but different term rarity; check a repeated proportional vector keeps the expected cosine relationship.",
        "edge_cases": "Zero vectors; unseen vocabulary; all-common terms; very long sparse documents.",
        "missing_evidence": "Return a visible pending state when required inputs are absent; do not fabricate data.",
        "usefulness": "Predeclare a task-specific comparator and acceptance threshold, then evaluate on held-out data with relevant subgroups.",
        "recovery": "Interrupt at each committed work boundary and confirm deterministic replay or declared stochastic equivalence without losing completed work."
      },
      "resource_plan": {
        "work_unit": "One sparse vector pair or bounded postings chunk.",
        "checkpoint_contents": "Vocabulary identity, cursor and partial sparse dot products.",
        "peak_memory_bytes": null,
        "qualified_workload": null,
        "measurement_status": "unrun",
        "constraint": "Production analysis shares the combined Python-worker limit; lab research uses its separate approved profile. A resource plan is not proof that this method fits."
      },
      "rights": {
        "status": "not_reviewed",
        "jurisdictions": [
          "UK",
          "EU",
          "US"
        ],
        "copied_implementation": false,
        "dependency_admission": "none",
        "model_and_dataset_admission": "none",
        "patent_evidence": [],
        "decision_receipt": null
      },
      "approval": {
        "specification_path": null,
        "owner_approval_receipt": null
      },
      "evidence": {
        "implementation_paths": [],
        "test_receipts": [],
        "usefulness_receipts": [],
        "resource_receipts": [],
        "review_receipts": [],
        "release_receipt": null
      },
      "exclusion": null
    },
    {
      "id": "M-000003",
      "name": "Reciprocal rank fusion",
      "aliases": [],
      "family": "ensembles",
      "kind": "ensemble",
      "stage": "candidate",
      "counts_toward_release": false,
      "source_ids": [
        "SRC-0003"
      ],
      "summary": "Combine ranked lists using their positions rather than assuming their raw scores share a scale.",
      "proposed_use": "Combine eligible destination rankings.",
      "applicability": "Research only until admitted. The approved specification must define available evidence, public-content permissions and missing-data behaviour.",
      "input_contract_draft": "Versioned ranked candidate lists with defined tie and absence rules.",
      "output_contract_draft": "A fused ordering and per-list contributions.",
      "distinctness": {
        "review_status": "pending",
        "hypothesis": "Rescale one input score list without changing its order; the fused result must remain unchanged. Test a candidate supported by several lists.",
        "not_separate_methods": "Different rank constants, list weights or list permutations.",
        "duplicate_of": null
      },
      "test_ideas": {
        "distinguishing_example": "Rescale one input score list without changing its order; the fused result must remain unchanged. Test a candidate supported by several lists.",
        "edge_cases": "Empty lists; duplicate IDs; ties; a candidate absent from some lists.",
        "missing_evidence": "Return a visible pending state when required inputs are absent; do not fabricate data.",
        "usefulness": "Predeclare a task-specific comparator and acceptance threshold, then evaluate on held-out data with relevant subgroups.",
        "recovery": "Interrupt at each committed work boundary and confirm deterministic replay or declared stochastic equivalence without losing completed work."
      },
      "resource_plan": {
        "work_unit": "One bounded candidate-list merge.",
        "checkpoint_contents": "Input-list identities, offsets and accumulated rank contributions.",
        "peak_memory_bytes": null,
        "qualified_workload": null,
        "measurement_status": "unrun",
        "constraint": "Production analysis shares the combined Python-worker limit; lab research uses its separate approved profile. A resource plan is not proof that this method fits."
      },
      "rights": {
        "status": "not_reviewed",
        "jurisdictions": [
          "UK",
          "EU",
          "US"
        ],
        "copied_implementation": false,
        "dependency_admission": "none",
        "model_and_dataset_admission": "none",
        "patent_evidence": [],
        "decision_receipt": null
      },
      "approval": {
        "specification_path": null,
        "owner_approval_receipt": null
      },
      "evidence": {
        "implementation_paths": [],
        "test_receipts": [],
        "usefulness_receipts": [],
        "resource_receipts": [],
        "review_receipts": [],
        "release_receipt": null
      },
      "exclusion": null
    },
    {
      "id": "M-000004",
      "name": "PageRank",
      "aliases": [],
      "family": "graph_analysis",
      "kind": "algorithm",
      "stage": "candidate",
      "counts_toward_release": false,
      "source_ids": [
        "SRC-0004"
      ],
      "summary": "Estimate graph importance from repeated movement along links with restart handling.",
      "proposed_use": "Supply an explained internal-link graph signal.",
      "applicability": "Research only until admitted. The approved specification must define available evidence, public-content permissions and missing-data behaviour.",